{
  "target_dimensions": [
    {
      "dimension_id": "D1",
      "name": "spatial_relation",
      "priority": "high"
    }
  ],
  "real_image_targets": [
    {
      "query_or_path": "user_provided_real_image_roots/",
      "needed": true,
      "min_samples": 0
    }
  ],
  "existing_benchmark_targets": [
    {
      "benchmark_name": "example_vlm_spatial_benchmark",
      "needed": true,
      "split": [
        "val",
        "test"
      ]
    }
  ],
  "simulator_targets": [
    {
      "simulator_id": "carla",
      "needed": true,
      "scenes": [],
      "seeds": []
    }
  ],
  "required_modalities": [
    "rgb",
    "depth",
    "pose",
    "semantic"
  ],
  "required_gt_fields": [
    "agent_pose",
    "object_pose",
    "depth",
    "segmentation"
  ],
  "quality_constraints": [
    "Every GT field must include provenance.",
    "No LLM-only GT."
  ]
}